{
	"$schema": "http://json-schema.org/schema#",
	"type": "object",
	"required": [
		"schema",
		"hydamo_version",
		"objects"
	],
	"properties": {
		"schema": {
			"type": "string",
			"enum": [
				"1.5"
			]
		},
		"hydamo_version": {
			"type": "string",
			"enum": [
				"2.5"
			]
		},
		"status_object": {
			"type": "array",
			"items": {
				"type": "string",
				"enum": [
					"planvorming",
					"realisatie",
					"gerealiseerd",
					"buiten bedrijf",
					"niet meer aanwezig",
					"te verwijderen",
					"onbekend"
				]
			}
		},
		"objects": {
			"type": "array",
			"items": {
				"$ref": "#/$defs/object_rules_set"
			}
		}
	},
	"$defs": {
		"object_rules_set": {
			"type": "object",
			"required": [
				"object",
				"validation_rules"
			],
			"properties": {
				"object": {
					"$ref": "#/$defs/hydamo_objects"
				},
				"general_rules": {
					"type": "array",
					"items": {
						"$ref": "#/$defs/general_rule"
					}
				},
				"validation_rules": {
					"minItems": 1,
					"type": "array",
					"items": {
						"$ref": "#/$defs/validation_rule"
					}
				}
			}
		},
		"general_rule": {
			"type": "object",
			"required": [
				"id",
				"result_variable",
				"function"
			],
			"properties": {
				"id": {
					"minItems": 1,
					"maxItems": 1,
					"type": "integer"
				},
				"result_variable": {
					"minItems": 1,
					"maxItems": 1,
					"type": "string",
					"pattern": "^[A-Za-z_][A-Za-z0-9_]*$"
				},
				"function": {
					"minItems": 1,
					"maxItems": 1,
					"type": "object",
					"oneOf": [
						{
							"$ref": "#/$defs/buffer"
						},
						{
							"$ref": "#/$defs/difference"
						},
						{
							"$ref": "#/$defs/divide"
						},
						{
							"$ref": "#/$defs/join_parameter"
						},
						{
							"$ref": "#/$defs/multiply"
						},
						{
							"$ref": "#/$defs/object_relation"
						},
						{
							"$ref": "#/$defs/sum"
						}
					]
				}
			}
		},
		"validation_rule": {
			"type": "object",
			"required": [
				"id",
				"name",
				"type",
				"error_type",
				"result_variable",
				"error_message",
				"active",
				"function"
			],
			"properties": {
				"id": {
					"minItems": 1,
					"maxItems": 1,
					"type": "integer"
				},
				"name": {
					"minItems": 1,
					"maxItems": 1,
					"type": "string"
				},
				"type": {
					"minItems": 1,
					"maxItems": 1,
					"type": "string",
					"enum": [
						"logic",
						"topologic"
					]
				},
				"exceptions": {
					"type": "array",
					"items": {
						"type": "string"
					},
					"uniqueItems": true
				},
				"filter": {
					"maxItems": 1,
					"type": "object",
					"oneOf": [
						{
							"$ref": "#/$defs/LE"
						},
						{
							"$ref": "#/$defs/LT"
						},
						{
							"$ref": "#/$defs/GE"
						},
						{
							"$ref": "#/$defs/GT"
						},
						{
							"$ref": "#/$defs/EQ"
						},
						{
							"$ref": "#/$defs/ISIN"
						},
						{
							"$ref": "#/$defs/NOTIN"
						},
						{
							"$ref": "#/$defs/NOTNA"
						}
					]
				},
				"error_type": {
					"minItems": 1,
					"maxItems": 1,
					"type": "string",
					"enum": [
						"critical",
						"non-critical"
					]
				},
				"penalty": {
					"maxItems": 1,
					"type": "integer",
					"minimum": 0,
					"maximum": 9
				},
				"result_variable": {
					"minItems": 1,
					"maxItems": 1,
					"type": "string",
					"pattern": "^[A-Za-z_][A-Za-z0-9_]*$"
				},
				"error_message": {
					"minItems": 1,
					"maxItems": 1,
					"type": "string"
				},
				"active": {
					"minItems": 1,
					"maxItems": 1,
					"type": "boolean"
				},
				"function": {
					"minItems": 1,
					"maxItems": 1,
					"type": "object",
					"oneOf": [
						{
							"$ref": "#/$defs/BE"
						},
						{
							"$ref": "#/$defs/compare_longitudinal"
						},
						{
							"$ref": "#/$defs/consistent_period"
						},
						{
							"$ref": "#/$defs/distant_to_others"
						},
						{
							"$ref": "#/$defs/EQ"
						},
						{
							"$ref": "#/$defs/GE"
						},
						{
							"$ref": "#/$defs/geometry_length"
						},
						{
							"$ref": "#/$defs/GT"
						},
						{
							"$ref": "#/$defs/ISIN"
						},
						{
							"$ref": "#/$defs/LE"
						},
						{
							"$ref": "#/$defs/LT"
						},
						{
							"$ref": "#/$defs/no_dangling_node"
						},
						{
							"$ref": "#/$defs/not_overlapping"
						},
						{
							"$ref": "#/$defs/NOTIN"
						},
						{
							"$ref": "#/$defs/NOTNA"
						},
						{
							"$ref": "#/$defs/join_object_exists"
						},
						{
							"$ref": "#/$defs/snaps_to_hydroobject"
						},
						{
							"$ref": "#/$defs/splitted_at_junction"
						},
						{
							"$ref": "#/$defs/structures_at_boundaries"
						},
						{
							"$ref": "#/$defs/structures_at_intersections"
						},
						{
							"$ref": "#/$defs/structures_at_nodes"
						}
					]
				},
				"tags": {
					"type": "array",
					"items": {
						"type": "string"
					},
					"uniqueItems": true
				}
			}
		},
		"buffer": {
			"type": "object",
			"required": [
				"buffer"
			],
			"properties": {
				"buffer": {
					"type": "object",
					"required": [
						"radius",
						"percentile",
						"coverage"
					],
					"properties": {
						"radius": {
							"type": [
								"string",
								"number"
							]
						},
						"percentile": {
							"type": "integer"
						},
						"coverage": {
							"type": "string",
							"enum": [
								"AHN"
							]
						},
						"fill_value": {
							"type": "number"
						}
					}
				}
			}
		},
		"difference": {
			"type": "object",
			"required": [
				"difference"
			],
			"properties": {
				"difference": {
					"type": "object",
					"required": [
						"left",
						"right"
					],
					"properties": {
						"left": {
							"type": [
								"string",
								"number"
							]
						},
						"right": {
							"type": [
								"string",
								"number"
							]
						},
						"absolute": {
							"type": "boolean"
						}
					}
				}
			}
		},
		"divide": {
			"type": "object",
			"required": [
				"divide"
			],
			"properties": {
				"divide": {
					"type": "object",
					"required": [
						"left",
						"right"
					],
					"properties": {
						"left": {
							"type": [
								"string",
								"number"
							]
						},
						"right": {
							"type": [
								"string",
								"number"
							]
						}
					}
				}
			}
		},
		"join_parameter": {
			"type": "object",
			"required": [
				"join_parameter"
			],
			"properties": {
				"join_parameter": {
					"type": "object",
					"required": [
						"join_object",
						"join_parameter"
					],
					"properties": {
						"join_object": {
							"$ref": "#/$defs/hydamo_objects"
						},
						"join_parameter": {
							"type": "string"
						},
						"fill_value": {
							"type": "number"
						}
					}
				}
			}
		},
		"multiply": {
			"type": "object",
			"required": [
				"mulitply"
			],
			"properties": {
				"multiply": {
					"type": "object",
					"required": [
						"left",
						"right"
					],
					"properties": {
						"left": {
							"type": [
								"string",
								"number"
							]
						},
						"right": {
							"type": [
								"string",
								"number"
							]
						}
					}
				}
			}
		},
		"object_relation": {
			"type": "object",
			"required": [
				"object_relation"
			],
			"properties": {
				"object_relation": {
					"type": "object",
					"required": [
						"related_object",
						"statistic"
					],
					"properties": {
						"related_object": {
							"$ref": "#/$defs/hydamo_objects"
						},
						"related_parameter": {
							"type": "string"
						},
						"statistic": {
							"type": "string",
							"enum": [
								"min",
								"majority",
								"max",
								"sum",
								"count"
							]
						},
						"fill_value": {
							"type": "number"
						}
					}
				}
			}
		},
		"sum": {
			"type": "object",
			"required": [
				"sum"
			],
			"properties": {
				"sum": {
					"type": "object",
					"required": [
						"array"
					],
					"properties": {
						"array": {
							"type": "array",
							"items": {
								"type": [
									"number",
									"string"
								]
							}
						}
					}
				}
			}
		},
		"BE": {
			"type": "object",
			"required": [
				"BE"
			],
			"properties": {
				"BE": {
					"type": "object",
					"required": [
						"parameter",
						"min",
						"max",
						"inclusive"
					],
					"properties": {
						"parameter": {
							"type": "string"
						},
						"min": {
							"type": [
								"number",
								"string"
							]
						},
						"max": {
							"type": [
								"number",
								"string"
							]
						},
						"inclusive": {
							"type": "boolean"
						}
					}
				}
			}
		},
		"consistent_period": {
			"type": "object",
			"required": [
				"consistent_period"
			],
			"properties": {
				"consistent_period": {
					"type": "object",
					"properties": {
						"max_gap": {
							"type": "integer"
						}
					}
				}
			}
		},
		"EQ": {
			"type": "object",
			"required": [
				"EQ"
			],
			"properties": {
				"EQ": {
					"type": "object",
					"required": [
						"left",
						"right"
					],
					"properties": {
						"left": {
							"type": [
								"string",
								"number"
							]
						},
						"right": {
							"type": [
								"string",
								"number"
							]
						}
					}
				}
			}
		},
		"GE": {
			"type": "object",
			"required": [
				"GE"
			],
			"properties": {
				"GE": {
					"type": "object",
					"required": [
						"left",
						"right"
					],
					"properties": {
						"left": {
							"type": [
								"string",
								"number"
							]
						},
						"right": {
							"type": [
								"string",
								"number"
							]
						}
					}
				}
			}
		},
		"GT": {
			"type": "object",
			"required": [
				"GT"
			],
			"properties": {
				"GT": {
					"type": "object",
					"required": [
						"left",
						"right"
					],
					"properties": {
						"left": {
							"type": [
								"string",
								"number"
							]
						},
						"right": {
							"type": [
								"string",
								"number"
							]
						}
					}
				}
			}
		},
		"ISIN": {
			"type": "object",
			"required": [
				"ISIN"
			],
			"properties": {
				"ISIN": {
					"type": "object",
					"required": [
						"parameter",
						"array"
					],
					"properties": {
						"parameter": {
							"type": "string"
						},
						"array": {
							"type": "array",
							"items": {
								"type": "string"
							}
						}
					}
				}
			}
		},
		"LE": {
			"type": "object",
			"required": [
				"LE"
			],
			"properties": {
				"LE": {
					"type": "object",
					"required": [
						"left",
						"right"
					],
					"properties": {
						"left": {
							"type": [
								"string",
								"number"
							]
						},
						"right": {
							"type": [
								"string",
								"number"
							]
						}
					}
				}
			}
		},
		"LT": {
			"type": "object",
			"required": [
				"LT"
			],
			"properties": {
				"LT": {
					"type": "object",
					"required": [
						"left",
						"right"
					],
					"properties": {
						"left": {
							"type": [
								"string",
								"number"
							]
						},
						"right": {
							"type": [
								"string",
								"number"
							]
						}
					}
				}
			}
		},
		"NOTIN": {
			"type": "object",
			"required": [
				"NOTIN"
			],
			"properties": {
				"NOTIN": {
					"type": "object",
					"required": [
						"parameter",
						"array"
					],
					"properties": {
						"parameter": {
							"type": "string"
						},
						"array": {
							"type": "array",
							"items": {
								"type": "string"
							}
						}
					}
				}
			}
		},
		"NOTNA": {
			"type": "object",
			"required": [
				"NOTNA"
			],
			"properties": {
				"NOTNA": {
					"type": "object",
					"required": [
						"parameter"
					],
					"properties": {
						"parameter": {
							"type": "string"
						}
					}
				}
			}
		},
		"join_object_exists": {
			"type": "object",
			"required": [
				"join_object_exists"
			],
			"properties": {
				"join_object_exists": {
					"type": "object",
					"required": [
						"join_object"
					],
					"properties": {
						"join_object": {
							"$ref": "#/$defs/hydamo_objects"
						}
					}
				}
			}
		},
		"compare_longitudinal": {
			"type": "object",
			"required": [
				"compare_longitudinal"
			],
			"properties": {
				"compare_longitudinal": {
					"type": "object",
					"required": [
						"parameter",
						"compare_object",
						"compare_parameter",
						"logical_operator",
						"direction"
					],
					"properties": {
						"parameter": {
							"type": "string"
						},
						"compare_object": {
							"$ref": "#/$defs/hydamo_objects"
						},
						"compare_parameter": {
							"type": "string"
						},
						"logical_operator": {
							"type": "string",
							"enum": [
								"GT",
								"LT"
							]
						},
						"direction": {
							"type": "string",
							"enum": [
								"upstream",
								"downstream"
							]
						}
					}
				}
			}
		},
		"distant_to_others": {
			"type": "object",
			"required": [
				"distant_to_others"
			],
			"properties": {
				"distant_to_others": {
					"type": "object",
					"required": [
						"distance"
					],
					"properties": {
						"distance": {
							"type": "number"
						}
					}
				}
			}
		},
		"geometry_length": {
			"type": "object",
			"required": [
				"geometry_length"
			],
			"properties": {
				"geometry_length": {
					"type": "object",
					"required": [
						"length",
						"statistic"
					],
					"properties": {
						"length": {
							"type": "number"
						},
						"statistic": {
							"type": "string",
							"enum": [
								"min",
								"max"
							]
						}
					}
				}
			}
		},
		"no_dangling_node": {
			"type": "object",
			"required": [
				"no_dangling_node"
			],
			"properties": {
				"no_dangling_node": {
					"type": "object",
					"required": [
						"tolerance"
					],
					"properties": {
						"tolerance": {
							"type": "number"
						}
					}
				}
			}
		},
		"not_overlapping": {
			"type": "object",
			"required": [
				"not_overlapping"
			],
			"properties": {
				"not_overlapping": {
					"type": "object",
					"required": [
						"tolerance"
					],
					"properties": {
						"tolerance": {
							"type": "number"
						}
					}
				}
			}
		},
		"snaps_to_hydroobject": {
			"type": "object",
			"required": [
				"snaps_to_hydroobject"
			],
			"properties": {
				"snaps_to_hydroobject": {
					"type": "object",
					"required": [
						"method"
					],
					"properties": {
						"tolerance": {
							"type": "number"
						},
						"method": {
							"type": "string",
							"enum": [
								"overall",
								"intersecting",
								"centroid",
								"ends"
							]
						}
					}
				}
			}
		},
		"splitted_at_junction": {
			"type": "object",
			"required": [
				"splitted_at_junction"
			],
			"properties": {
				"splitted_at_junction": {
					"type": "object",
					"required": [
						"tolerance"
					],
					"properties": {
						"tolerance": {
							"type": "number"
						}
					}
				}
			}
		},
		"structures_at_boundaries": {
			"type": "object",
			"required": [
				"structures_at_boundaries"
			],
			"properties": {
				"structures_at_boundaries": {
					"type": "object",
					"required": [
						"tolerance",
						"structures",
						"areas"
					],
					"properties": {
						"tolerance": {
							"type": "number"
						},
						"structures": {
							"type": "array",
							"items": {
								"type": "string",
								"enum": [
									"gemaal",
									"stuw",
									"duikersifonhevel"
								]
							}
						},
						"areas": {
							"type": "string",
							"enum": [
								"afvoergebiedaanvoergebied",
								"peilafwijkinggebied",
								"peilbesluitgebied",
								"peilgebiedpraktijk",
								"peilgebiedvigerend"
							]
						}
					}
				}
			}
		},
		"structures_at_intersections": {
			"type": "object",
			"required": [
				"structures_at_intersections"
			],
			"properties": {
				"structures_at_intersections": {
					"type": "object",
					"required": [
						"tolerance",
						"structures"
					],
					"properties": {
						"tolerance": {
							"type": "number"
						},
						"structures": {
							"type": "array",
							"items": {
								"type": "string",
								"enum": [
									"duikersifonhevel",
									"aquaduct"
								]
							}
						}
					}
				}
			}
		},
		"structures_at_nodes": {
			"type": "object",
			"required": [
				"structures_at_nodes"
			],
			"properties": {
				"structures_at_nodes": {
					"type": "object",
					"required": [
						"tolerance",
						"structures"
					],
					"properties": {
						"tolerance": {
							"type": "number"
						},
						"structures": {
							"type": "array",
							"items": {
								"type": "string",
								"enum": [
									"gemaal",
									"stuw",
									"bodemval"
								]
							}
						}
					}
				}
			}
		},
		"hydamo_objects": {
			"type": "string",
			"enum": [
				"admingrenswaterschap",
				"afsluitmiddel",
				"afvoeraanvoergebied",
				"afvoergebiedaanvoergebied",
				"aquaduct",
				"beheergrenswaterschap",
				"bijzonderhydraulischobject",
				"bodemval",
				"brug",
				"doorstroomopening",
				"duikersifonhevel",
				"gemaal",
				"grondwaterinfolijn",
				"grondwaterinfopunt",
				"grondwaterkoppellijn",
				"grondwaterkoppelpunt",
				"hydrologischerandvoorwaarde",
				"hydroobject",
				"hydroobject_normgp",
				"imwa_geoobject",
				"kunstwerkopening",
				"lateraleknoop",
				"leggerwatersysteem",
				"leggerwaterveiligheid",
				"meetlocatie",
				"meetwaardeactiewaarde",
				"normgeparamprofiel",
				"normgeparamprofielwaarde",
				"peilafwijkinggebied",
				"peilbesluitgebied",
				"peilgebiedpraktijk",
				"peilgebiedvigerend",
				"pomp",
				"profielgroep",
				"profiellijn",
				"profielpunt",
				"regelmiddel",
				"reglementgrenswaterschap",
				"streefpeil",
				"sturing",
				"stuw",
				"vispassage",
				"vispassagevlak",
				"vuilvang",
				"waterbeheergebied",
				"zandvang"
			]
		}
	}
}