{
	"schema": "1.5",
	"hydamo_version": "2.5",
	"status_object": [
		"planvorming",
		"gerealiseerd"
	],
	"objects": [
		{
			"object": "profiellijn",
			"general_rules": [
				{
					"id": 0,
					"result_variable": "bodemhoogte",
					"function": {
						"object_relation": {
							"statistic": "min",
							"related_object": "profielpunt",
							"related_parameter": "geometry.z"
						}
					}
				},
				{
					"id": 1,
					"result_variable": "bodemhoogte_marge_min",
					"function": {
						"difference": {
							"left": "bodemhoogte",
							"right": 0.2
						}
					}
				}
			],
			"validation_rules": [
				{
					"id": 0,
					"name": "Profiel moet intersecten met een waterlijn",
					"type": "topologic",
					"validation_rule_set": "basic",
					"error_type": "critical",
					"result_variable": "op_watergang",
					"error_message": "niet op watergang",
					"active": true,
					"function": {
						"snaps_to_hydroobject": {
							"method": "overall"
						}
					}
				}
			]
		},
		{
			"object": "duikersifonhevel",
			"general_rules": [
				{
					"id": 0,
					"result_variable": "maaiveldhoogte",
					"function": {
						"buffer": {
							"radius": 10,
							"percentile": 95,
							"coverage": "AHN",
							"fill_value": 325
						}
					}
				},
				{
					"id": 1,
					"result_variable": "delta_h",
					"function": {
						"difference": {
							"left": "hoogtebinnenonderkantbov",
							"right": "hoogtebinnenonderkantbene"
						}
					}
				},
				{
					"id": 2,
					"result_variable": "verval",
					"function": {
						"difference": {
							"left": "hoogtebinnenonderkantbov",
							"right": "hoogtebinnenonderkantbene",
							"absolute": true
						}
					}
				},
				{
					"id": 3,
					"result_variable": "slope",
					"function": {
						"divide": {
							"left": "delta_h",
							"right": "lengte"
						}
					}
				}
			],
			"validation_rules": [
				{
					"id": 0,
					"name": "BOK bovenstrooms plausibel (-8m - maaiveld)",
					"type": "logic",
					"validation_rule_set": "basic",
					"error_type": "critical",
					"result_variable": "bok_boven_plausibel",
					"error_message": "bok_boven niet plausibel",
					"exceptions": [
					],
					"active": true,
					"function": {
						"BE": {
							"parameter": "hoogtebinnenonderkantbov",
							"min": -8,
							"max": 325,
							"inclusive": false
						}
					}
				},
				{
					"id": 1,
					"name": "BOK benedenstrooms plausibel (-8m - maaiveld)",
					"type": "logic",
					"validation_rule_set": "basic",
					"error_type": "critical",
					"result_variable": "bok_beneden_plausibel",
					"error_message": "bok_beneden niet plausibel",
					"active": true,
					"function": {
						"BE": {
							"parameter": "hoogtebinnenonderkantbene",
							"min": -8,
							"max": 325,
							"inclusive": false
						}
					}
				},
				{
					"id": 2,
					"name": "BOK bovenstrooms onder maaiveld",
					"type": "logic",
					"validation_rule_set": "basic",
					"error_type": "critical",
					"result_variable": "bok_boven_lt_maaiveld",
					"error_message": "bok_boven > maaiveld",
					"active": true,
					"function": {
						"LT": {
							"left": "hoogtebinnenonderkantbov",
							"right": "maaiveldhoogte"
						}
					}
				},
				{
					"id": 3,
					"name": "BOK benedenstrooms onder maaiveld",
					"type": "logic",
					"validation_rule_set": "basic",
					"error_type": "critical",
					"result_variable": "bok_beneden_lt_maaiveld",
					"error_message": "bok_beneden > maaiveld",
					"active": true,
					"function": {
						"LT": {
							"left": "hoogtebinnenonderkantbene",
							"right": "maaiveldhoogte"
						}
					}
				},
				{
					"id": 4,
					"name": "Lengte groter dan 1 m",
					"type": "logic",
					"validation_rule_set": "basic",
					"error_type": "non-critical",
					"result_variable": "lengte_duiker_groter_dan_1m",
					"error_message": "lengte < 1m",
					"active": true,
					"function": {
						"GT": {
							"left": "lengte",
							"right": 1.0
						}
					}
				},
				{
					"id": 5,
					"name": "Een ronde duikersifonhevel heeft een breedte die gelijk is aan de hoogte",
					"type": "logic",
					"validation_rule_set": "basic",
					"error_type": "non-critical",
					"result_variable": "breedte_eq_hoogte",
					"error_message": "breedteopening != hoogteopening",
					"active": true,
					"filter": {
						"ISIN": {
							"parameter": "vormkoker",
							"array": [
								"Rond"
							]
						}
					},
					"function": {
						"EQ": {
							"left": "breedteopening",
							"right": "hoogteopening"
						}
					}
				},
				{
					"id": 6,
					"name": "Dit object moet precies samenvallen met het hydroobject",
					"type": "topologic",
					"validation_rule_set": "basic",
					"error_type": "critical",
					"result_variable": "op_hydroobject",
					"error_message": "hydroobject niet op hydroobject",
					"active": true,
					"function": {
						"snaps_to_hydroobject": {
							"tolerance": 0.01,
							"method": "ends"
						}
					}
				},
				{
					"id": 7,
					"name": "Het bodemverhang van een duiker moet liggen tussen -2 cm/m (omhoog) en 5 cm/m (omlaag)",
					"type": "logic",
					"validation_rule_set": "basic",
					"error_type": "non-critical",
					"result_variable": "verhang_between_2cmpm_en_5cm",
					"error_message": "verhang_onjuist",
					"active": true,
					"function": {
						"BE": {
							"parameter": "slope",
							"min": -0.02,
							"max": 0.05,
							"inclusive": false
						}
					}
				},
				{
					"id": 8,
					"name": "Het bodemverval over een duiker mag niet groter zijn dan 50 cm",
					"type": "logic",
					"validation_rule_set": "basic",
					"error_type": "non-critical",
					"result_variable": "verval_lt_50cm",
					"error_message": "verval_te_groot",
					"active": true,
					"function": {
						"LT": {
							"left": "verval",
							"right": 0.5
						}
					}
				},
				{
					"id": 9,
					"name": "Een duikersifonhevel zal geen overlap met een andere duikersifonhevel hebben",
					"type": "topologic",
					"validation_rule_set": "basic",
					"error_type": "critical",
					"result_variable": "geen_overlap",
					"error_message": "overlapping",
					"active": true,
					"function": {
						"not_overlapping": {
							"tolerance": 0.01
						}
					}
				},
				{
					"id": 10,
					"name": "De BOK bovenstrooms mag slechts minimaal lager liggen dan de bovenstroomse bodemhoogte van het hydroobject",
					"type": "topologic",
					"validation_rule_set": "basic",
					"error_type": "critical",
					"result_variable": "bok_bov_boven_bodem",
					"error_message": "bok bovenstrooms beneden bodem",
					"active": true,
					"function": {
						"compare_longitudinal": {
							"parameter": "hoogtebinnenonderkantbov",
							"compare_object": "profiellijn",
							"compare_parameter": "bodemhoogte_marge_min",
							"logical_operator": "GT",
							"direction": "upstream"
						}
					}
				},
				{
					"id": 11,
					"name": "De BOK benedenstrooms mag slechts minimaal lager liggen dan de bendenstroomse bodemhoogte van het hydroobject",
					"type": "topologic",
					"validation_rule_set": "basic",
					"error_type": "critical",
					"result_variable": "bok_ben_boven_bodem",
					"error_message": "bok bendenstrooms beneden bodem",
					"active": true,
					"function": {
						"compare_longitudinal": {
							"parameter": "hoogtebinnenonderkantbene",
							"compare_object": "profiellijn",
							"compare_parameter": "bodemhoogte_marge_min",
							"logical_operator": "GT",
							"direction": "downstream"
						}
					}
				}
			]
		},
		{
			"object": "kunstwerkopening",
			"validation_rules": [
				{
					"id": 0,
					"name": "hoogstedoorstroomhoogte plausibel (-8m - 325m)",
					"type": "logic",
					"validation_rule_set": "basic",
					"error_type": "critical",
					"result_variable": "hoogstedoorstroomhoogte_plausibel",
					"error_message": "hoogstedoorstroomhoogte niet plausibel",
					"active": true,
					"function": {
						"BE": {
							"parameter": "hoogstedoorstroomhoogte",
							"min": -8,
							"max": 325,
							"inclusive": false
						}
					}
				},
				{
					"id": 1,
					"name": "laagstedoorstroomhoogte plausibel (-8m - 325m)",
					"type": "logic",
					"validation_rule_set": "basic",
					"error_type": "critical",
					"result_variable": "laagstedoorstroomhoogte_plausibel",
					"error_message": "laagstedoorstroomhoogte niet plausibel",
					"active": true,
					"function": {
						"BE": {
							"parameter": "laagstedoorstroomhoogte",
							"min": -8,
							"max": 325,
							"inclusive": false
						}
					}
				},
				{
					"id": 2,
					"name": "De laagste doorstroombreedte moet kleiner zijn dan de hoogste doorstroombreedte, bij een driehoekige of trapeziumvormige opening",
					"type": "logic",
					"validation_rule_set": "basic",
					"error_type": "critical",
					"result_variable": "laagstedrstrmbreedte_lt_hoogstedrstrmbreedte",
					"error_message": "laagstedrstrmbreedte > hoogstedrstrmbreedte",
					"active": true,
					"filter": {
						"ISIN": {
							"parameter": "vormopening",
							"array": [
								"Driehoekig",
								"Trapeziumvormig"
							]
						}
					},
					"function": {
						"LT": {
							"left": "laagstedoorstroombreedte",
							"right": "hoogstedoorstroombreedte"
						}
					}
				},
				{
					"id": 3,
					"name": "De laagste doorstroomhoogte moet kleiner zijn dan de hoogste doorstroomhoogte",
					"type": "logic",
					"validation_rule_set": "basic",
					"error_type": "critical",
					"result_variable": "laagstedrstrmhoogte_lt_hoogstedrstrmhoogte",
					"error_message": "laagstedrstrmhoogte > hoogstedrstrmhoogte",
					"active": true,
					"function": {
						"LT": {
							"left": "laagstedoorstroomhoogte",
							"right": "hoogstedoorstroomhoogte"
						}
					}
				},
				{
					"id": 4,